{"$schema":"https://json-schema.org/draft/2020-12/schema","$id":"https://abvx.invalid/schemas/evidence-record/v1","title":"ABVX Evidence Record","type":"object","additionalProperties":false,"required":["id","source","timestamp","candidate","fixture","result","metrics","stdout_ref","stderr_ref","artifact_refs","provenance","environment"],"properties":{"id":{"type":"string"},"source":{"type":"string"},"timestamp":{"type":"string","format":"date-time"},"candidate":{"type":"string"},"fixture":{"type":"string"},"result":{"enum":["PASS","CONDITIONAL_PASS","FAIL","INCONCLUSIVE","TIMEOUT"]},"metrics":{"type":"object","additionalProperties":true},"stdout_ref":{"type":"string"},"stderr_ref":{"type":"string"},"artifact_refs":{"type":"array","items":{"type":"string"}},"provenance":{"type":"object","required":["recorded_by"],"properties":{"recorded_by":{"type":"string"},"source_uri":{"type":["string","null"]},"observed_at":{"type":["string","null"]}},"additionalProperties":false},"environment":{"type":"object","additionalProperties":true}}}
